{
  "$schema": "http://json-schema.org/draft-07/schema#",
  "$id": "https://lovdacn.vercel.app/schema.json",
  "title": "lvcn.json",
  "description": "Configuration for a lovdaCN project. Active values only; legacy values are migrated by the CLI.",
  "type": "object",
  "properties": {
    "$schema": {
      "type": "string",
      "description": "The URL of the JSON schema for this file."
    },
    "style": {
      "type": "string",
      "description": "The active visual style recipe.",
      "enum": [
        "luma",
        "lyra",
        "maia",
        "mira",
        "nova",
        "rhea",
        "sera",
        "vega"
      ]
    },
    "styleEngine": {
      "type": "string",
      "description": "The styling runtime.",
      "enum": [
        "nativewind",
        "uniwind"
      ]
    },
    "tsx": {
      "type": "boolean",
      "description": "Whether generated source uses TypeScript."
    },
    "tailwind": {
      "type": "object",
      "properties": {
        "config": {
          "type": "string"
        },
        "css": {
          "type": "string"
        },
        "baseColor": {
          "type": "string",
          "enum": [
            "zinc",
            "slate",
            "stone",
            "gray",
            "neutral",
            "taupe",
            "mauve",
            "olive",
            "mist"
          ]
        }
      },
      "required": [
        "css"
      ]
    },
    "aliases": {
      "type": "object",
      "properties": {
        "components": {
          "type": "string"
        },
        "utils": {
          "type": "string"
        },
        "ui": {
          "type": "string"
        }
      },
      "required": [
        "components",
        "utils"
      ]
    },
    "components": {
      "type": "array",
      "items": {
        "type": "string"
      }
    },
    "baseColor": {
      "type": "string",
      "enum": [
        "zinc",
        "slate",
        "stone",
        "gray",
        "neutral",
        "taupe",
        "mauve",
        "olive",
        "mist"
      ]
    },
    "theme": {
      "type": "string",
      "enum": [
        "zinc",
        "slate",
        "stone",
        "gray",
        "neutral",
        "red",
        "orange",
        "amber",
        "yellow",
        "lime",
        "green",
        "emerald",
        "teal",
        "cyan",
        "sky",
        "blue",
        "indigo",
        "violet",
        "purple",
        "fuchsia",
        "pink",
        "rose"
      ]
    },
    "chartColor": {
      "type": "string",
      "enum": [
        "zinc",
        "slate",
        "stone",
        "gray",
        "neutral",
        "red",
        "orange",
        "amber",
        "yellow",
        "lime",
        "green",
        "emerald",
        "teal",
        "cyan",
        "sky",
        "blue",
        "indigo",
        "violet",
        "purple",
        "fuchsia",
        "pink",
        "rose"
      ]
    },
    "font": {
      "type": "string",
      "enum": [
        "inter",
        "dm-sans",
        "nunito-sans",
        "figtree",
        "outfit",
        "manrope",
        "space-grotesk",
        "montserrat",
        "roboto",
        "raleway",
        "public-sans",
        "source-sans-3",
        "lora",
        "merriweather",
        "playfair-display",
        "jetbrains-mono",
        "space-mono",
        "fira-code",
        "noto-serif",
        "roboto-slab",
        "instrument-sans",
        "instrument-serif",
        "geist"
      ]
    },
    "iconLibrary": {
      "type": "string",
      "enum": [
        "lucide",
        "phosphor",
        "tabler",
        "expo",
        "heroicons"
      ]
    },
    "radius": {
      "type": "string",
      "enum": [
        "default",
        "none",
        "small",
        "medium",
        "large",
        "full"
      ]
    }
  },
  "required": [
    "style",
    "tailwind",
    "aliases"
  ]
}
